final_result/01_prefill_token_power_modeling/gpu1_350w_block_nocache_fixed_0_20000/images_front_0_3000/fit_results.json

{
  "avg_power_w": {
    "type": "linear",
    "coefficients": [
      0.03576230118185584,
      184.63676032395085
    ],
    "r2": 0.8319962524682756,
    "formula": "y = 0.0357623x +184.6368"
  },
  "peak_power_w": {
    "type": "linear",
    "coefficients": [
      0.02414460433151925,
      236.5046083228696
    ],
    "r2": 0.5842502075332714,
    "formula": "y = 0.0241446x +236.5046"
  },
  "p95_power_w": {
    "type": "linear",
    "coefficients": [
      0.0244433288552725,
      234.29340090732038
    ],
    "r2": 0.5856710369369791,
    "formula": "y = 0.0244433x +234.2934"
  },
  "median_power_w": {
    "type": "linear",
    "coefficients": [
      0.024038268871243437,
      232.84900537412184
    ],
    "r2": 0.5817344145086738,
    "formula": "y = 0.0240383x +232.8490"
  },
  "avg_active_power_w": {
    "type": "linear",
    "coefficients": [
      0.024267705202516594,
      214.58019985489065
    ],
    "r2": 0.6919107787352863,
    "formula": "y = 0.0242677x +214.5802"
  },
  "avg_ttft_ms": {
    "type": "linear",
    "coefficients": [
      0.1357990173202465,
      61.04874716207402
    ],
    "r2": 0.996813580807916,
    "formula": "y = 0.135799x +61.0487"
  },
  "first_ttft_ms": {
    "type": "linear",
    "coefficients": [
      0.1341275368915617,
      62.73108340844914
    ],
    "r2": 0.9965259982152804,
    "formula": "y = 0.134128x +62.7311"
  },
  "avg_energy_j": {
    "type": "linear",
    "coefficients": [
      0.21677964136707104,
      546.259754004401
    ],
    "r2": 0.8659800180736719,
    "formula": "y = 0.21678x +546.2598"
  },
  "avg_energy_per_request_j": {
    "type": "linear",
    "coefficients": [
      0.03893427411824647,
      9.067105021651685
    ],
    "r2": 0.9944978970237338,
    "formula": "y = 0.0389343x +9.0671"
  }
}

final_result/01_prefill_token_power_modeling/gpu1_350w_block_nocache_fixed_0_20000/images_front_0_3000/prefill_modeling_report.md

# Prefill Token-Power Modeling Report

- Raw data: `experiment_results/prefill_token_power_modeling/gpu1_350w_block_nocache_fixed_0_20000/prefill_token_power_modeling_1777904889_raw.csv`
- Valid samples: 156
- Target token range: 1 - 3000
- Actual token range: 1 - 3000
- Polynomial degree: 2
- Non-power fit mode: linear
- Front-only max token: 3000.0
- Power fit: `y = 0.0357623x +184.6368`, R2=0.8320
- Active power fit: `y = 0.0242677x +214.5802`, R2=0.6919
- Energy-per-request fit: `y = 0.0389343x +9.0671`, R2=0.9945